{
  "mappingStatus": "mapped",
  "recommendationIds": [],
  "profiles": ["L1"],
  "policy": {
    "name": "Synthetic Settings [L1]",
    "description": "Copyright-safe historical reference fixture.",
    "platforms": "windows10",
    "technologies": "mdm",
    "roleScopeTagIds": ["0"]
  },
  "settings": [
    {
      "@odata.type": "#microsoft.graph.deviceManagementConfigurationSetting",
      "settingInstance": {
        "@odata.type": "#microsoft.graph.deviceManagementConfigurationChoiceSettingInstance",
        "settingDefinitionId": "synthetic_choice",
        "choiceSettingValue": {
          "@odata.type": "#microsoft.graph.deviceManagementConfigurationChoiceSettingValue",
          "value": "synthetic_choice_enabled",
          "children": []
        }
      }
    },
    {
      "@odata.type": "#microsoft.graph.deviceManagementConfigurationSetting",
      "settingInstance": {
        "@odata.type": "#microsoft.graph.deviceManagementConfigurationSimpleSettingCollectionInstance",
        "settingDefinitionId": "synthetic_string_collection",
        "simpleSettingCollectionValue": [
          {
            "@odata.type": "#microsoft.graph.deviceManagementConfigurationStringSettingValue",
            "value": "principal-a"
          },
          {
            "@odata.type": "#microsoft.graph.deviceManagementConfigurationStringSettingValue",
            "value": "principal-b"
          }
        ]
      }
    },
    {
      "@odata.type": "#microsoft.graph.deviceManagementConfigurationSetting",
      "settingInstance": {
        "@odata.type": "#microsoft.graph.deviceManagementConfigurationGroupSettingCollectionInstance",
        "settingDefinitionId": "synthetic_group",
        "groupSettingCollectionValue": [
          {
            "@odata.type": "#microsoft.graph.deviceManagementConfigurationGroupSettingValue",
            "children": [
              {
                "@odata.type": "#microsoft.graph.deviceManagementConfigurationChoiceSettingInstance",
                "settingDefinitionId": "synthetic_group_enabled",
                "choiceSettingValue": {
                  "@odata.type": "#microsoft.graph.deviceManagementConfigurationChoiceSettingValue",
                  "value": "synthetic_group_enabled_true",
                  "children": []
                }
              },
              {
                "@odata.type": "#microsoft.graph.deviceManagementConfigurationSimpleSettingInstance",
                "settingDefinitionId": "synthetic_group_cadence",
                "simpleSettingValue": {
                  "@odata.type": "#microsoft.graph.deviceManagementConfigurationIntegerSettingValue",
                  "value": 90
                }
              }
            ]
          }
        ]
      }
    },
    {
      "@odata.type": "#microsoft.graph.deviceManagementConfigurationSetting",
      "settingInstance": {
        "@odata.type": "#microsoft.graph.deviceManagementConfigurationChoiceSettingInstance",
        "settingDefinitionId": "synthetic_parent_choice",
        "choiceSettingValue": {
          "@odata.type": "#microsoft.graph.deviceManagementConfigurationChoiceSettingValue",
          "value": "synthetic_parent_choice_enabled",
          "children": [
            {
              "@odata.type": "#microsoft.graph.deviceManagementConfigurationGroupSettingCollectionInstance",
              "settingDefinitionId": "synthetic_nested_group",
              "groupSettingCollectionValue": [
                {
                  "@odata.type": "#microsoft.graph.deviceManagementConfigurationGroupSettingValue",
                  "children": [
                    {
                      "@odata.type": "#microsoft.graph.deviceManagementConfigurationSimpleSettingInstance",
                      "settingDefinitionId": "synthetic_nested_key",
                      "simpleSettingValue": {
                        "@odata.type": "#microsoft.graph.deviceManagementConfigurationStringSettingValue",
                        "value": "key-a"
                      }
                    },
                    {
                      "@odata.type": "#microsoft.graph.deviceManagementConfigurationSimpleSettingInstance",
                      "settingDefinitionId": "synthetic_nested_value",
                      "simpleSettingValue": {
                        "@odata.type": "#microsoft.graph.deviceManagementConfigurationStringSettingValue",
                        "value": "value-a"
                      }
                    }
                  ]
                },
                {
                  "@odata.type": "#microsoft.graph.deviceManagementConfigurationGroupSettingValue",
                  "children": [
                    {
                      "@odata.type": "#microsoft.graph.deviceManagementConfigurationSimpleSettingInstance",
                      "settingDefinitionId": "synthetic_nested_key",
                      "simpleSettingValue": {
                        "@odata.type": "#microsoft.graph.deviceManagementConfigurationStringSettingValue",
                        "value": "key-b"
                      }
                    },
                    {
                      "@odata.type": "#microsoft.graph.deviceManagementConfigurationSimpleSettingInstance",
                      "settingDefinitionId": "synthetic_nested_value",
                      "simpleSettingValue": {
                        "@odata.type": "#microsoft.graph.deviceManagementConfigurationStringSettingValue",
                        "value": "value-b"
                      }
                    }
                  ]
                }
              ]
            }
          ]
        }
      }
    }
  ]
}
